{
  "schema_version": "schauwerk-miro-mcp-tool-reference.v1",
  "source_url": "https://developers.miro.com/docs/miro-mcp-prompts",
  "observed_at": "2026-07-17T04:32:00Z",
  "operational_authority": "diagnostic_only_live_catalogue_remains_authoritative",
  "tools": [
    "board_create",
    "board_list_items",
    "board_search_boards",
    "code_widget_create",
    "code_widget_delete",
    "code_widget_get",
    "code_widget_list_items",
    "code_widget_update",
    "comment_list_comments",
    "comment_reply",
    "comment_resolve",
    "context_explore",
    "context_get",
    "diagram_create",
    "diagram_get_dsl",
    "doc_create",
    "doc_get",
    "doc_update",
    "image_create",
    "image_get_data",
    "image_get_upload_url",
    "image_get_url",
    "layout_create",
    "layout_get_dsl",
    "layout_read",
    "layout_update",
    "prototype_create",
    "prototype_read",
    "table_create",
    "table_list_rows",
    "table_sync_rows"
  ]
}
